地点,短评,出发时间,天数,人均费用,人物,玩法,浏览量
西安,一场只属于我们两父子的旅行――35天9省区畅游祖国壮丽山河之陕西-宁夏篇,/2020/08/12,6,2400,亲子,第一次?穷游?美食?暑假,300
开封,开封第1天――1.1开封府,/2021/02/27,1,400,家庭,深度游?徒步?美食?冬季,16000
三亚,三亚小众玩法春天刚来，我便开始想念海边的漫时光,/2021/01/31,4,2600,三五好友,自驾?美食?摄影,2729
延吉,延吉十八时辰，孤独“美食家”的不孤独脚步,/2020/12/25,2,500,独自一人,短途周末?美食?摄影?冬季,9521
漳州,六天五夜，探秘闽北闽南人间秘境,/2021/02/19,6,1200,三五好友,自驾?春节?踏春,4901
三亚,【三亚旅游】姐妹一起超High！四天三夜海边狂欢，住宿美食、景点交通全攻略,/2020/12/22,4,2000,闺蜜,美食?夏季?寒假,10000
三亚,在北纬18°的“东方夏威夷”三亚，赴一场椰风、海韵与美食的约会,/2021/02/05,4,1000,三五好友,短途周末?自驾?美食?冬季,9148
成都,一场只属于我们两父子的旅行――35天9省区畅游祖国壮丽山河之四川篇2,/2020/07/28,6,2100,亲子,第一次?穷游?美食?暑假,379
成都,一场只属于我们两父子的旅行――35天9省区畅游祖国壮丽山河之四川篇1,/2020/07/25,3,700,亲子,短途周末?骑行?穷游?暑假,338
镇江,一日一景一食--镇江,/2020/11/07,2,150,独自一人,第一次?短途周末?徒步?赏秋,69000
铜仁,（自驾游）经济实惠的第一土豪游。。。桃花源――思州温泉城,/2021/01/25,1,200,三五好友,自驾?穷游?温泉?春节?冬季,7628
瑶里,我在China看china,/2020/11/30,5,1020,独自一人,骑行?徒步?摄影?赏秋,8896
厦门,行摄厦门，三天两夜带你感受最惬意的鹭岛慢生活,/2021/01/16,3,2000,独自一人,美食?摄影?海滨海岛?冬季?寒假,6635
三亚,三亚慢生活，美食，美景，美美的心情,/2020/12/22,4,2000,闺蜜,短途周末?游轮?美食?冬季,8745
北海,【面向大海，远离雨雨雨】2019年2月春节北海涠洲岛4日避寒游,/2019/02/07,4,2500,家庭,短途周末?环游?海滨海岛?春节,8560
康定,荼蘼期ㄏ2021.01甘孜（冷嘎措）徒步三日行记,/2021/01/01,3,1500,三五好友,自驾?徒步?跨年,21000
西安,自驾西安两日游，看尽长安古今繁华,/2021/01/20,2,800,独自一人,短途周末?自驾?古镇?冬季,31000
重庆,“山城”重庆，我们来啦！,/2020/12/21,4,1500,情侣,第一次?徒步?美食?圣诞,2699
洛阳,洛阳第一天,/2021/01/09,1,300,家庭,深度游?冬季,7645
南通,【旅途不止】在冬日的暖阳里爱上这座城，南通自驾三日游,/2020/12/19,2,1500,情侣,短途周末?自驾?摄影?圣诞?冬季,16000
三亚,旋风少女：关于海的思念，从春到冬，从阴到晴，一路逛一路吃,/2021/11/26,5,2500,三五好友,深度游?自驾?穷游?冬季?寒假,12000
重庆,重庆森林，一部现实与梦境交织的电影,/2020/12/29,1,2000,三五好友,深度游?美食?摄影,952
阳朔,为爱而行---2020冬桂林山水甲天下,/2020/11/20,8,2000,独自一人,第一次?赏枫,588
长沙,湖南寻迹桃花源，逛吃在长沙,/2020/11/26,3,2500,闺蜜,美食,12000
厦门,厦门十日自由行，穷游,/2020/12/12,10,1925,家庭,第一次?深度游?穷游?圣节?圣诞,9995
三亚,三亚旅行｜周末惬意自驾打卡网红景点附美食攻略,/2020/11/24,3,2000,闺蜜,短途周末?美食?摄影?冬季,45000
三亚,2021三亚旅游，3天2夜，边吃边玩边购物，实用攻略请收藏,/2020/11/25,3,2000,三五好友,深度游?短途周末?自驾?冬季?寒假,24000
汕头,一天八顿的汕头美食之旅~不愧为中华美食之都,/2020/10/29,4,2000,闺蜜,第一次?深度游?美食?国庆,25000
武义,遇上60年最寒冷的冬天，泡进武义最温暖的温泉,/2020/12/11,3,2000,情侣,短途周末?温泉?古镇?冬季,14000
康定,冰封的眼泪―海螺沟，听、这里有雪落下的声音,/2020/12/22,3,1000,三五好友,自驾?圣诞,706
西安,母女游西安,/2020/12/10,4,2535,亲子,短途周末?冬季,4705
黔南,多彩贵州一路黔行烟雨西江过苗年5天4晚一个北方人贵州寻梦之旅,/2020/11/20,5,2000,三五好友,深度游?自驾?摄影?冬季,20000
陵水,【海南岛】挖了一袋子海平线背后的宝藏,/2020/11/16,5,2000,独自一人,第一次?自驾?摄影?冬季,12000
三亚,三亚旅行4天3夜人均2000玩转小众免费景点+美食攻略,/2020/08/11,4,2000,闺蜜,美食?摄影?海滨海岛?暑假,12000
常德,湖南常德武陵渔人所言不假，世间真有“桃花源”,/2020/11/27,3,1200,三五好友,短途周末?自驾?冬季,813
北京,【48小时.遇上北京】2020年11月600年的皇城二十年后我们又相见了,/2020/11/27,3,1500,独自一人,短途周末?摄影?赏秋,11000
邛崃,成都周边的宝藏地推荐：邛崃天台山，平乐古镇，大梁酒庄,/2020/11/18,2,500,三五好友,骑行?古镇,57000
武汉,周末随心飞――英雄之城武汉,/2020/11/28,2,500,独自一人,第一次?短途周末?冬季,2700
庐山,庐山之美，千变化,/2020/11/28,2,1140,独自一人,短途周末?徒步?冬季,3217
昆明,秋日周末游―春城昆明,/2020/11/28,2,500,独自一人,短途周末,5488
大理,走！一路向西，自驾去大理,/2020/07/16,6,2000,家庭,自驾?环游?古镇?夏季?暑假,15000
深圳,深圳、珠海、澳门自由行,/2020/11/21,6,2700,家庭,环游,14000
邛崃,森吸氧天台山，醉美大梁酒庄，悠游平乐古镇，美好周末从邛崃开始,/2020/11/21,2,1000,家庭,自驾?摄影?古镇?赏秋,59000
海西,四访大理，用一杯风花雪月换一段海西光阴,/2020/10/29,4,2000,三五好友,深度游?自驾?摄影,13000
杭州,那场跨越千年的钱塘梦，与西子湖畔的悲欢离合｜杭州文旅指南,/2020/11/19,10,1300,独自一人,深度游?穷游?摄影?暑假?寒假,15000
南京,秦淮，跨越600年的桨声灯影｜南京文旅攻略,/2020/11/03,7,1000,独自一人,深度游?毕业游?穷游?国庆?冬季,16000
长沙,长沙短游,/2020/11/19,3,1000,情侣,短途周末?赏秋?冬季,7332
阿坝,阿坝4日游,/2020/11/19,4,800,家庭,自驾?短途周末?冬季,18000
三亚,三亚全攻略：到三亚看过了海，才算是过完了完整的一年,/2020/11/21,3,2000,三五好友,美食?摄影?探险?冬季,21000
重庆,重庆一半市井，一半文艺,/2020/11/19,3,1500,情侣,短途周末,10000
三亚,南航快乐飞之打飞的到三亚度个周末,/2020/11/08,3,1500,情侣,冬季,12000
额济纳旗,探天造奇观寻最美黄叶作者黎明之光,/2020/10/13,8,2225,三五好友,深度游?自驾?摄影?赏秋?国庆,9684
宁国,皖秋行摄：皖南川藏线上明珠、打卡“水上喀纳斯、皖南小千岛湖”,/2020/11/10,2,1000,三五好友,深度游?摄影,19000
铜仁,乌江一日游――初步了解乌江文化和土家族文化,/2020/12/01,1,300,三五好友,短途周末?游轮?穷游?冬季?寒假,12000
昆明,漫行昆明：见山水，见人间,/2020/09/28,6,2500,家庭,深度游?美食?摄影?中秋节?国庆,12000
丽江,苍山洱海旁，你在我身边----在丽江与大理的七天,/2020/10/28,7,2500,情侣,第一次,773
平遥,说走就走，出发到山西看千年古建秋色~,/2020/11/03,5,1000,家庭,短途周末?自驾?古镇?冬季?寒假,18000
莫干山,深秋初见莫干山--3天2晚小众游,/2020/11/01,3,2000,三五好友,第一次?短途周末?美食?赏秋,4870
阿尔山,呼伦贝尔、阿尔山4日自由行在北方的北方，请签收这份秋日的温暖,/2020/09/17,4,2300,闺蜜,深度游?自驾?摄影?赏秋?国庆,13000
开封,赏菊展，看演出，清明上河园48小时漫游记,/2020/10/19,2,600,三五好友,深度游?摄影,30000
稻城,【稻城亚丁】拉上可爱的人，去看一场秋天の童话吧~,/2020/10/15,6,1043,三五好友,自驾?摄影,446
剑阁,深秋畅游剑门蜀道,/2020/10/21,3,500,三五好友,短途周末?摄影?古镇?赏秋,58000
南京,南京4日游,/2020/10/19,4,1000,独自一人,徒步,18000
徐州,一日一景一食--徐州,/2020/10/21,3,900,独自一人,第一次?短途周末?美食?赏秋,567
三亚,四天三晚，在三亚体验舒适的度假慢生活~,/2020/09/11,4,2800,三五好友,购物?美食?海滨海岛,23000
无锡,走进无锡，太湖江畔好风光，爱上拈花湾、灵山圣境好壮美,/2020/10/17,3,1000,三五好友,美食?摄影?古镇?国庆?赏秋,32000
大同,国庆中秋山西全家7日游――跨越1300多公里欣赏祖国大地上的别样风景,/2020/10/14,8,2500,家庭,第一次?自驾?国庆,664
曲阜,首游山东,/2020/10/10,4,1218,独自一人,穷游?赏秋,20000
宿迁,项王故里、骆马湖畔--2天1晚借“宿”之旅，秋赏衲田花海,/2020/10/13,2,1200,家庭,深度游?赏秋?国庆,19000
肇庆,如果你想去肇庆旅行，看我这篇游记就够了！,/2020/10/01,5,1200,三五好友,短途周末?自驾?摄影?国庆,96000
宏村,"黄山区,黟县,长沙5日游",/2020/10/08,4,1200,独自一人,徒步?穷游,45000
太谷,国庆中秋双佳节山西大院我来游（祁县太谷）,/2020/10/02,4,1200,家庭,深度游?摄影?古镇?中秋节?国庆,282
平遥,平遥古城周边游（祁县乔家大院、灵石王家大院）全网最全攻略！,/2020/10/11,3,1000,家庭,自驾?美食?古镇?赏秋?冬季,26000
古北水镇,【北京】京郊水镇，后疫情生活中收获的意外惊喜,/2020/09/02,2,1000,独自一人,古镇,189000
山海关,这么炫的天下第一关见过吗？逛古城爬长城，山海关访古美食之旅,/2020/09/26,2,300,三五好友,美食?摄影?古镇?中秋节?国庆,25000
丹东,金秋9月，中朝边境?自驾?游,/2020/09/12,17,2600,三五好友,深度游?自驾?穷游?赏秋,1640
泉州,国庆闽南赏美景、贴秋膘,/2020/10/01,7,2500,家庭,自驾?美食?中秋节?国庆,1888
遂平,伏牛山小环线：老君山、寺山、渠首、酷浆/2020/10/04,4,1200,家庭,自驾?中秋节?国庆,1095,
蓝山,清甜的八月瓜、悠扬婉转的瑶歌、云雾缭绕的山林、瑶乡的米酒让我醉了,/2020/09/28,1,800,三五好友,第一次?国庆,49000
广州,国庆中秋双节，食在广州,/2020/10/05,4,2700,情侣,第一次?美食?中秋节?国庆,14000
黄山,皖美初见*水墨宏村诗画西递梦里徽州自驾六日游,/2020/10/03,6,2000,情侣,深度游?自驾?美食?国庆,941
阳朔,疫情后国庆假期的广西之旅~~~,/2020/10/03,5,2700,家庭,第一次?美食?国庆,13000
北京,2020国庆北京5日家庭自助游,/2020/10/03,5,1668,家庭,第一次?深度游?徒步?中秋节?国庆,4659
康定,2020年国庆――《从你的全世界路过》之理塘、乡城行,/2020/10/01,1,1500,家庭,自驾?中秋节?国庆,38000
郴州,郴州东江湖自由行,/2020/10/07,2,698,三五好友,穷游?国庆,94000
五台山,又见五台山，还愿祈福！,/2020/10/02,3,1000,三五好友,自驾?徒步?国庆,207000
南浔,#十一度假宝地#莫干山-南浔古镇-千岛湖(7日自驾)，有山有水还有楼,/2020/09/11,7,2500,三五好友,深度游?短途周末?自驾?中秋节?国庆,62000
包头,包头～云贵川,/2020/10/02,28,3,家庭,自驾?中秋节?国庆,724
三亚,泡酒店、吃美食、沙滩玩耍，三亚亲子游的正确打开方式！,/2020/09/17,5,2500,亲子,自驾?美食?海滨海岛?国庆,23000
三清山,婺源、三清山之旅,/2020/09/22,5,2349,三五好友,第一次?赏秋,191000
敦煌,周末随心飞――西北三省终极打卡！,/2020/09/19,7,2200,情侣,第一次?中秋节,72000
重庆,川渝土著重庆N次游宝藏经验大总结-吃喝玩一篇就够了！,/2020/09/26,4,2000,三五好友,短途周末?中秋节?国庆,11000
莫干山,上海至莫干山自驾三日游,/2020/08/30,3,1400,家庭,自驾?夏季,605
临海,趁秋未凉，来台州临海，探寻千年古城的新与旧,/2020/09/24,2,2000,三五好友,短途周末?古镇?国庆,26000
临海,临海漫游记，感受这座千年古城的古韵与新潮,/2020/09/19,2,1500,三五好友,深度游?国庆,30000
镇远,一日一景一食--贵州,/2020/09/13,7,2900,独自一人,第一次?深度游?徒步?赏秋,1717
丽江,丽江―香格里拉9日游,/2020/08/22,9,2700,独自一人,第一次?夏季,4839
涞水,河北【保定.涞水】野三坡白草畔早秋之旅,/2020/09/20,1,180,三五好友,自驾?徒步?摄影?赏秋,19700
曲阜,曲阜泰安周末三日游,/2020/09/11,3,1300,情侣,短途周末?自驾?国庆,918
威海,走进精致开放的梦幻海滨小城――威海四日休闲游,/2020/09/17,4,2000,独自一人,短途周末?徒步?海滨海岛?暑假?国庆,198000
重庆,尝美食三绝，游亚洲第一瀑布I重庆周边好去处,/2020/09/19,2,600,三五好友,短途周末?美食?摄影?中秋节?国庆,38000
佛山,花式技能解锁地，和闺蜜穿越到欧洲的森林度假区,/2020/09/13,2,1000,闺蜜,美食?探险?滑雪?暑假?赏秋,63000
苏州,吴侬软语美娇娘，一曲评弹绘浮生――苏州随意版二日游记,/2020/09/19,2,700,情侣,自驾,122000
三亚,三亚吃货漫游记，无处不自在,/2020/08/23,3,2000,情侣,海滨海岛?暑假,16000
西安,2020国庆节前陕西自驾11日游,/2020/08/28,11,2800,三五好友,自驾?赏秋,1023
松原,随心所欲玩转吉林省！6天5晚人均1000自驾游，现在的吉林也很美,/2020/07/20,6,2000,情侣,自驾?暑假,54000
成都,休闲成都游十一；――郫县唐昌古镇，追寻崇宁旧县遗韵,/2020/09/13,1,50,三五好友,自驾,98000
贵阳,山水黔地似画卷，千户苗寨多风情-姐妹四人贵州游,/2020/09/01,6,2300,闺蜜,深度游,6614
武夷山,武夷山4日游,/2020/09/09,4,1300,独自一人,徒步?赏秋,198000
三亚,三亚｜久困于都市的人渴望一片海浪,/2020/08/20,3,2000,情侣,短途周末?夏季,11000
野三坡,河北【保定.涞水】野三坡百里峡与清泉山,/2020/09/06,1,100,三五好友,深度游?短途周末?自驾?夏季,208000
龙脊梯田,北京出发，桂林阳朔7日游,/2020/09/04,7,2600,情侣,第一次,453
三亚,突袭三亚！72小时倒计时，这次三亚旅行我拒绝平庸！,/2020/08/17,3,2000,情侣,夏季,13000
阳朔,每一个不曾起舞的日子，都是对生命的辜负--阳朔三日游,/2020/09/18,3,2000,三五好友,第一次?短途周末?摄影?赏秋,1690
通化,吉林超小众的自驾游线路，带你挖掘宝藏景点和新鲜玩法！,/2020/07/13,5,1500,三五好友,深度游?自驾?海滨海岛?暑假,84000
重庆,「学生党穷游山城」人均500（含食宿）的国庆重庆三日游最强攻略,/2020/09/02,3,500,闺蜜,穷游?美食?摄影?国庆,163000
承德,秋初去避暑――承德和塞罕坝秋景,/2020/08/31,3,420,三五好友,自驾?赏秋,4167
安庆,夏季旅行，盘点安徽安庆不可错过的六大游玩胜地,/2020/08/21,3,2000,三五好友,短途周末?自驾?徒步,94000
重庆,成渝之旅（1人游）,/2020/08/26,4,1000,独自一人,短途周末?夏季,118000
敦煌,青海甘肃15日环游（绵阳出发）,/2020/07/31,15,2200,家庭,自驾?暑假,3202
香港,疫情下的香港，我好惦念那些热爱过的深水睹朗超/2019/08/31,1,30,情侣,深度游?美食?短途周末?夏季,57000,
平遥,漫游平遥，迷人的古城，来了不想走,/2020/08/20,3,800,三五好友,深度游?美食?古镇?暑假,9832
承德,体验浪漫童话世界，去七彩森林看坝上绝美风景,/2020/08/22,3,1000,亲子,自驾?夏季,5782
宜昌,游三{人家，观清江画廊,/2020/08/28,3,1000,家庭,自驾?夏季,526
安庆,三天两夜，带你玩转天柱山,/2020/08/24,3,2000,三五好友,徒步?摄影?夏季,52000
重庆,这些年你欠重庆的电影票应该补上啦！神雕侠旅带你重庆电影取景地巡礼。,/2020/08/15,4,2500,情侣,自驾?摄影?夏季,17000
横店,横店记事，这个夏末，我在横店拍大片,/2020/08/18,3,2000,三五好友,摄影,38000
北海,带老爸老妈一起玩！,/2020/08/29,8,2839,家庭,第一次?夏季,3260
襄阳,最美襄阳亲子自驾三日游，大美风景人间值得,/2020/08/29,3,2100,三五好友,自驾,1150000
重庆,在重庆B归故里|2天走完重庆最复古的4个小众打卡点,/2020/08/25,2,300,闺蜜,摄影,230000
上海,呼吸间有艺术气息，唇齿间有香茗回甘――这个沪郊的博物馆，会不会是下一个网红点,/2020/08/16,2,1000,三五好友,短途周末?自驾?美食?夏季?暑假,10000
济南,漫步济南，一个惊艳到我的城市，超乎我的想象！,/2020/08/20,4,1000,家庭,自驾?暑假,6368
重庆,洪崖洞重逢1980街区藏在江边楼里的八十年代老重庆,/2020/08/24,1,50,闺蜜,第一次?短途周末?摄影?夏季,21000
三亚,三亚吃喝玩乐全攻略，你想要的都可以有,/2020/08/22,1,2000,三五好友,深度游,97000
长沙,欢迎来到长沙！这里有喝不完的茶颜吃不完的辣！,/2020/08/16,3,1634,情侣,第一次?穷游?美食?暑假,2960000
太原,6日游,/2020/08/14,6,2000,家庭,深度游?暑假,236
桂林,（四日桂林阳朔经典游）一叶轻舟过，烟雨漓江，诗意阳朔【桂林旅游攻略】,/2020/03/22,4,2000,家庭,摄影,150000
张家界,左手长沙右手张家界，初探湘西武陵源~张家界旅游攻略,/2019/07/05,4,2500,亲子,摄影?夏季,8226
额济纳旗,金秋十月赏胡杨(银川包车出发额济纳旗胡杨林四日游),/2020/08/17,4,1500,三五好友,深度游?摄影?美食?国庆?赏秋,285000
黄果树,贵州笑笑生与赢赢阿姨有点久远的荔波黄果树瀑布之行,/2014/07/11,5,1700,三五好友,第一次?夏季,11000
张家界,回忆游记2016年张家界看石头的那段时光,/2016/05/09,4,1475,三五好友,夏季,18000
青岛,和生命里的美好击掌相笑，烟台威海青岛行,/2020/08/06,8,2800,亲子,第一次?美食?海滨海岛?暑假,1656
珠海,珠海海泉湾邂逅清新“地中海风情”，和爱的TA沉醉于天然海洋温泉的无尽浪漫,/2020/08/08,2,500,情侣,短途周末?温泉?海滨海岛?夏季?暑假,31000
嵊泗,误打误撞的嵊泗之旅，突发状况超多体验却是如此的棒！,/2020/08/09,4,1700,家庭,第一次?深度游?游轮?夏季?暑假,8844
克什克腾旗,草原之旅-北京自驾锡林郭勒盟8天游记,/2020/08/04,8,1500,三五好友,深度游?自驾?夏季?暑假,410000
重庆,初识恩施大峡谷，再访神农架野人谷,/2020/08/08,6,1950,三五好友,自驾?环游?暑假,292000
平遥,平遥古城免费游~这些攻略必须有！,/2020/08/13,3,600,家庭,深度游?自驾?古镇?暑假?赏秋,212000
平遥,如果只有2-3天，我会这样带你玩遍平遥古城,/2020/08/13,3,800,三五好友,深度游?美食?古镇?夏季,60000
昆明,昆明丨到七彩云南避暑度假，游欢乐世界，看古滇文化,/2020/08/05,3,1500,三五好友,深度游?暑假,69000
重庆,"中秋	/国庆3日游攻略，让时光驻足重庆这座人间秘境",/2020/07/30,3,1500,三五好友,毕业游?穷游?美食?中秋节?国庆,22000
青岛,青岛四日（重庆人在青岛爬山）,/2020/07/30,4,1800,家庭,第一次?暑假?夏季,285000
常州,戏水的夏日茅山宝盛园里的盛夏度假时光,/2020/07/24,3,1500,亲子,短途周末,12000
聊城,跟着小说去旅行，走进千年古城聊城，3天2晚感受最山东的盛夏况味,/2020/08/01,3,2000,三五好友,自驾?美食?摄影,11000
峨眉山,来过个21度的夏天吧~避暑胜地峨眉山,/2020/07/18,2,800,亲子,短途周末?自驾?徒步?夏季?暑假,9174
金川,探寻金川昌都寺，一窥西藏真正的根,/2020/04/04,3,660,三五好友,深度游?自驾?清明,39000
武夷山,2020开眼看世界之武夷山,/2020/05/08,2,800,独自一人,短途周末?徒步?五一,56000
平遥,平遥一座去掉家乡滤镜依然很美丽的古城,/2020/08/06,3,800,三五好友,深度游?美食?古镇?暑假,24000
丽江,父子同游丽江-疫情下初体验纳西美景,/2020/07/05,7,2500,亲子,自驾?摄影?古镇?夏季?暑假,3417
三亚,孕期旅行｜一个身体两颗心跳，带你去天之涯海之角，邂逅网红却又安静的三亚,/2020/07/04,6,2500,家庭,自驾?美食?摄影?夏季?暑假,15000
井冈山,闺蜜江西周游记（汕头出发，游羊狮慕，武功山，钓源，井冈山）,/2020/07/26,8,2515,闺蜜,第一次?自驾?深度游?暑假,1694
三亚,KK寻那抹“蓝”，一路向南,/2020/08/04,1,2600,家庭,深度游?自驾?环游?暑假,6974
荣成,【马玛丽旅行志】行走西霞口，邂逅山海环抱的诗意美地,/2020/07/30,4,1000,三五好友,深度游?短途周末?自驾,18000
峨眉山,峨眉山｜2014年一场酣畅淋漓的徒步修行,/2020/07/31,4,900,三五好友,第一次?徒步?赏秋,1143
沈阳,东北首站“盛京”沈阳周末游,/2020/07/17,3,1800,三五好友,短途周末,1102
张家口,河北【张家口.崇礼】京北武功山-水泉子村大鹰梁璀璨满坡金莲花,/2020/07/19,1,120,三五好友,短途周末?徒步?摄影?夏季,85000
承德,以马为梦，带着孩子自驾感受一场17度的夏天,/2020/07/12,3,1500,亲子,自驾,3736
银川,旺季双飞12日游宁夏银川中卫，人均2900，看看我们怎么玩,/2020/06/13,12,2900,亲子,第一次?穷游?深度游?夏季?暑假,93000
长白山,2020盛夏自驾游长白山最新攻略，地球人都知道的避暑胜地，还是中国爱情圣山,/2020/07/07,5,2000,三五好友,自驾?夏季,9780
平遥,来真的？平遥古城免费了！最全平遥古城攻略在手！,/2020/07/15,2,1000,学生,自驾?毕业游?古镇?夏季?暑假,26000
呼伦贝尔,嘿！你见过草原吗｜遇见呼伦贝尔，满眼都是柔情,/2020/07/03,5,2500,三五好友,深度游?自驾?暑假,16000
西安,古都行--西安、开封,/2019/08/07,6,2300,独自一人,徒步?美食?夏季,7045
重庆,【山城-雾都】重庆-武隆-奥陶纪5天4晚-吃住行详细攻略,/2020/07/11,5,2000,家庭,深度游?自驾?美食?夏季?冬季,1429
成都,天府古镇记ㄏ仲夏一隅五凤溪,/2020/07/05,1,100,三五好友,古镇?夏季,9710
重庆,藏于山隐于巷，5D重庆的魔幻江湖,/2020/06/08,5,1000,三五好友,深度游?自驾?摄影,33000
常德,柳叶湖畔，寻回向往已久的生活（湖南常德3天2晚小众度假攻略）,/2020/06/28,3,2800,三五好友,深度游?短途周末?自驾?夏季?暑假,36000
漳州,端午3天漳州东山岛佛系游,/2020/06/26,3,1000,家庭,自驾?端午,1920
全南,【遇见绝美全南】七月，沉醉在全南的山水画卷里,/2020/06/14,3,2000,三五好友,摄影?夏季,72000
全南,广州自驾3小时出省逃离都市喧嚣静享全南美好时光,/2020/06/12,3,1500,三五好友,短途周末?自驾?美食,59000
阳朔,在端午的粽香中再遇桂林阳朔～闲云野鹤般的三日悠闲时光,/2020/06/25,3,800,家庭,古镇?端午,11000
平遥,平遥故事古城72小时,/2020/06/28,3,800,三五好友,深度游?古镇?端午,16000
长沙,带你吃遍长沙美食,/2020/06/10,2,1500,三五好友,美食,32000
东阳,横店巨有戏，带你穿越千年，打卡热门影视剧拍摄地,/2020/06/22,3,2000,三五好友,深度游?自驾?毕业游?暑假?国庆,26000
铜仁,多彩贵州-心之旅-陪伴你在最美的风景在路上,/2020/06/21,10,1680,三五好友,深度游?摄影?探险?夏季,17000
营口,"抓住夏天的尾巴,感受营口版“向往的生活”",/2020/06/13,4,2000,三五好友,第一次?深度游?美食?夏季,20000
汕头,吃吃吃の汕头吃货之旅,/2020/06/25,3,500,闺蜜,短途周末?美食?端午,1738
成都,老成都人写的成都游记,/2020/06/01,1,200,三五好友,深度游?短途周末?美食?夏季?暑假,6893
晋中,一瓦知夏・夏以为夏・不期而遇【平遥古城及周边游干货分享】,/2020/06/17,3,1000,三五好友,第一次?美食?古镇,17000
南京,奔向旅途・沪宁杭全新攻略,/2020/06/20,5,600,三五好友,环游?暑假,3342
温州,温暖温州-----2019冬日之行,/2019/12/20,4,1500,家庭,第一次?短途周末?圣诞,1676
上海,全家出动游沪杭丨徜徉梦幻迪士尼品西子风韵,/2020/06/10,5,2300,家庭,第一次?深度游?摄影?端午?夏季,3808
丽水,梦里的向往的生活，松阳宝藏乌托邦惬意三天两夜之行,/2020/06/09,3,2000,三五好友,深度游?自驾?美食?端午,12000
伊犁,北疆?夏日草原?伊犁,/2018/06/04,13,2800,三五好友,自驾?美食?摄影?夏季,6811
杭州,来杭州休闲度假，打开人间天堂新玩法,/2020/06/10,3,2000,三五好友,短途周末?美食?摄影?暑假,1427
西安,西安+华山佛系旅行攻略,/2020/06/03,7,2500,家庭,夏季?暑假,17000
上海,走入松江，不一样的上海郊野风情,/2020/06/06,21,1000,三五好友,深度游?短途周末?环游,22000
青岛,给第一次来青岛的小伙伴一篇满满的干货,/2020/05/21,3,1500,情侣,第一次?美食?海滨海岛,2533
小金,"川西自驾三日游:最美乡村古镇甲居藏寨,天堂般的原始村庄莫斯卡，免费耍雪巴郎山",/2020/04/30,3,930,情侣,深度游?自驾?摄影?五一,26000
西宁,陪你路过这个世界~（青海4天游）,/2020/06/02,4,2500,情侣,美食?摄影,3353
荔波,一路黔行，赴一场夏日盛宴！,/2020/05/24,12,2200,三五好友,自驾?美食,3866
玉溪,周末短行｜昆明抚仙湖畔，享受慵懒的亲子度假时光,/2020/05/30,3,2000,家庭,第一次?短途周末,74000
三亚,超值三亚，六月去玩！睡平价五星，逛热门景点，吃榜单美食,/2020/05/19,5,2500,情侣,深度游?美食?夏季,48000
大理,云南慢游11日VLOG全记录（昆明大理常规景点+小众网红景点旅拍）,/2020/04/06,11,2011,独自一人,深度游?摄影?古镇?五一?夏季,1351
青海湖,环青海湖骑行租电动摩托车攻略分享――摩旅之路在青海湖起步,/2020/06/04,4,800,情侣,毕业游?夏季?暑假,5954
