地点,短评,出发时间,天数,人均费用,人物,玩法,浏览量
牡丹江,有一种雪??只有去过雪乡才会懂,/2019/11/02,3,800,情侣,短途周末?冬季,26000
西安,长安美食十二时辰丨愿每个时辰都有美食温暖你的胃,/2019/10/15,1,800,三五好友,自驾?美食?夏季?冬季,47000
成都,生活有你，美食有我‖和我一起感受与众不同的美食,/2019/10/24,3,1500,闺蜜,短途周末,11000
重庆,勒是雾都！时隔几年再游山城重庆,/2019/10/22,4,1521,独自一人,深度游?摄影?冬季,16000
文成,旅游浙江最美小城，风景秀丽还是名人故里,/2019/10/29,4,2000,情侣,短途周末?美食?摄影,39000
文成,浙江秘境文成里的大好风光,/2019/11/02,4,2500,三五好友,深度游?徒步?温泉?赏秋,557
深圳,打卡深圳福田，亲身感受南粤之都的魅力,/2019/10/20,3,2500,三五好友,美食?摄影,3977
三亚,三亚有我甜甜的恋爱,/2019/10/17,6,2000,情侣,深度游,13000
曲阜,周末自驾尼山圣境，近距离感受儒家文化,/2019/10/13,2,1000,家庭,第一次?短途周末?自驾?国庆,24000
温州,浙里文成，伯温故里，畅享一场山水与文化交融之旅！,/2019/10/24,4,1200,三五好友,自驾?美食,21000
成都,成都美食，给我上了一课,/2019/09/29,3,1000,三五好友,美食?摄影,28000
仙本那,蓝色伊甸园――干杯！痛饮仙本那这杯完美佳酿,/2019/08/22,7,2500,情侣,深度游?穷游?潜水?暑假,12000
潮州,10月潮汕行完美的旅程！值得推荐的地方！,/2019/10/21,5,2000,亲子,第一次?海滨海岛?赏秋,45000
青岛,青岛浮山、山东大学毕业游之二,/2019/06/01,2,500,独自一人,短途周末?徒步?美食?夏季,5536
济南,陪老妈6日玩转泰山、济南全攻略,/2019/10/19,6,2700,家庭,美食?赏秋,7426
涠洲岛,【自驾8日】人生象，美景在路上，古镇海岛侗寨重器一个都不能少,/2020/05/04,8,2500,家庭,自驾?古镇?海滨海岛?五一?夏季,769
张家港,慢行张家港，这个秋日里的宝藏亲子游,/2019/10/12,2,1000,亲子,短途周末,8656
苏州,走进五彩沙洲，享受难忘的亲子时光,/2019/10/12,3,1000,亲子,短途周末?美食?温泉?赏秋?国庆,61000
华山,华山深度3日游,/2019/10/19,3,1500,闺蜜,深度游?赏秋,16000
扬州,扬州三日江南秋日里的广陵序曲,/2019/10/18,3,2500,三五好友,深度游?短途周末?美食?赏秋,29000
三亚,去三亚还能玩什么？请收下这份不逛“景点”的小众玩法攻略！,/2019/09/01,3,1500,三五好友,深度游?美食?摄影,8959
银川,神秘银川6日游,/2019/10/16,6,1500,家庭,第一次?国庆,14000
建水,探访滇南之旅――河口+建水两日游,/2019/10/21,3,500,家庭,第一次?短途周末,36000
西安,河南，山西，陕西火车自驾游,/2019/01/21,8,2600,三五好友,深度游?寒假,6468
佛山,寻味顺德，人文艺术及美食探索之旅,/2019/10/15,4,1200,家庭,美食?古镇?夏季?国庆,19000
辛特拉,暖阳里的葡萄牙,/2019/01/01,6,2400,独自一人,第一次?短途周末?跨年?圣诞,8173
杭州,【浙江.杭州.宋城】千年大宋一日还,/2019/10/08,3,900,家庭,自驾,19000
成都,海螺沟三日游,/2019/10/07,4,1800,家庭,短途周末?摄影?冬季?国庆,78000
兴城,兴城游记,/2018/10/16,2,300,独自一人,古镇,144000
厦门,厦门攻略二刷厦门，竟然如此好“呷”,/2019/09/12,4,2500,三五好友,购物?美食?摄影?夏季,42000
海西,我与祖国有个约会-国庆2500元自驾青海甘肃环线+金塔胡杨林,/2019/09/28,8,2500,情侣,自驾?环游?国庆,1237
西安,穿越千年之旅,/2019/09/29,4,2600,独自一人,第一次?国庆,6983
长沙,湖南四日游,/2019/10/04,4,2000,家庭,蜜月?国庆,5910
泉州,忙碌了一个国庆周，终于轮到我休息去玩啦~,/2019/10/08,4,1344,三五好友,海滨海岛,5271
贵阳,#深度攻略#姐妹情？！玩转贵阳之旅,/2019/10/03,7,2500,家庭,第一次?深度游?古镇?国庆,2862
上海迪士尼度假区,苏沪杭行记，云彩飘荡在水乡的记忆,/2019/10/05,5,2000,情侣,美食?蜜月?古镇?国庆,1402
厦门,重走厦门，网红美食探店+景点打卡全攻略,/2019/10/01,4,2000,三五好友,深度游?国庆?寒假,90000
枣庄,八个月宝宝出游记,/2019/10/07,3,800,家庭,自驾?国庆,15000
德清,魅力德清四日游，享受悠闲的度假之旅,/2019/10/08,4,2500,三五好友,深度游?短途周末?自驾?国庆,6865
泰山,带着老妈去旅行2（五岳之行――泰山、嵩山）,/2019/09/26,6,2000,家庭,徒步?穷游?国庆,4911
澳门,畅游澳门，欣赏我国最小的都市，感受别样的澳门风情,/2019/10/14,5,2900,三五好友,深度游?摄影?国庆,241
安康,【我的国庆70周年华诞】西安观升旗+安康汉阴自驾游,/2019/10/09,2,324,情侣,短途周末?自驾?国庆,25000
张家界,闻你千遍，不如一见,/2019/09/27,5,1800,三五好友,第一次,45000
琼中,说走就走的自驾环岛之旅,/2019/10/02,5,1500,三五好友,深度游?自驾?环游?赏秋?国庆,4822
南京,2019国庆节南京自驾三日游,/2019/10/04,3,1000,家庭,深度游?自驾?美食?国庆,1093
天津,天津3日游,/2019/10/03,3,1000,亲子,自驾?第一次?国庆,98000
石林,包头～黄河石林3日游,/2019/10/03,3,750,家庭,自驾?赏秋,3992
潮州,潮州3日游,/2019/10/05,3,100,独自一人,美食?穷游?国庆,6274
成都,不按套路出牌的成都美食们,/2019/10/01,7,100,三五好友,深度游?美食,119000
重庆,"重庆中秋打卡---寻梦幻城堡,觅千年磁器口,赏洪崖洞璀璨灯火",/2019/09/12,3,1000,三五好友,深度游?美食?摄影?中秋节,27000
白洋淀,包头～白洋淀3天自驾游,/2019/08/30,3,700,家庭,自驾?夏季,4686
龙游,漫步浙江龙游，享受这座小城娴静安逸的时光,/2019/10/05,2,1500,三五好友,美食?摄影?国庆,16000
成都,大头儿子，小头爸爸｜成都崽儿168小时。,/2019/10/05,7,2000,家庭,深度游?美食?摄影?国庆?寒假,112000
重庆,成都人眼中的重庆欢乐谷是个啥调性？感觉了一下，包你去就吐！呵呵……,/2019/10/01,1,500,家庭,第一次?深度游?国庆,5223
丹东,十月最“火”赏秋线路，自驾丹东，中国枫叶最红最艳的地方,/2019/10/06,3,500,三五好友,自驾?摄影?赏枫?国庆,5535
平遥,三天两晚，带你遇见平遥，领略古城魅力，解密你不知道的小知识,/2019/10/28,3,1500,三五好友,深度游,57.1
太原,太原6日游,/2019/10/02,6,1700,家庭,国庆,5545
平遥,平遥，又见平遥！这份详实的平遥出行攻略，敬请收下,/2019/09/25,3,1000,三五好友,第一次?短途周末?摄影?国庆,11.8
成都,【食色成都】12场味蕾与景色的双重盛宴,/2019/09/15,4,2000,闺蜜,自驾?中秋节,24000
平遥,时光静好｜初见平遥，又见平遥,/2019/09/25,2,1000,三五好友,短途周末?古镇?国庆,33000
三亚,搞砸了！五天四夜，我把三亚亲子游整成了三亚美食游。,/2019/09/20,5,1500,亲子,美食?海滨海岛,5003
郴州,广东的后花园隐匿的世外桃源―给你想要的湖南郴州,/2019/09/26,3,1000,情侣,短途周末?自驾?摄影?国庆,3090
厦门,邂逅厦门，约会四天的浪漫小时光,/2019/09/17,5,2000,情侣,深度游?海滨海岛,49000
承德,远方不远，北京以北，你向往的自由与梦想都在这条天路,/2019/09/27,3,1000,三五好友,自驾?摄影?暑假?赏秋,76000
呼和浩特,匆匆塞北游，意兴阑珊归,/2019/09/18,4,2300,独自一人,美食?赏秋,7652
成都,从成都到峨眉，我只想在这里的街头走一走,/2019/09/26,2,2000,三五好友,深度游?国庆,51000
平遥,打磨时光，幽幽古镇双城记,/2019/09/21,3,800,亲子,短途周末,63000
深圳,打个飞的去深圳，过一个文化艺术的周末！,/2019/09/20,3,2000,独自一人,短途周末?摄影,42000
三亚,三亚亲子游―2晚海景2晚泳池别墅的轻奢之旅,/2019/09/20,5,2600,亲子,自驾?游轮?海滨海岛?赏秋,78000
塞罕坝,塞罕坝的秋景,/2019/09/16,2,600,三五好友,自驾?中秋节,5416
大理,3天2晚，遇见不一样的彩云之南,/2019/09/23,3,1000,三五好友,自驾?温泉?古镇?国庆,48000
犍为,“乐”不思“蜀”――川蜀双城记,/2019/09/22,3,1000,三五好友,自驾?美食?摄影?中秋节,32000
临沂,金秋九月自驾沂蒙，邂逅你最美的一面,/2019/09/15,3,1000,家庭,短途周末?赏秋?国庆,78000
三亚,台风天怎么逛三亚才好玩？即使没有艳阳天，依然是满满的度假感~,/2019/09/01,2,1500,三五好友,短途周末?美食,6308
三亚,来三亚海边度个假，与家人共赴一场休闲美食之旅！,/2019/09/21,3,2000,亲子,短途周末?美食?海滨海岛?中秋节,38000
天津,2016年2017年2019年三次亲子游天津,/2015/12/31,3,600,亲子,短途周末?自驾?冬季,6504
张家界,入初秋，跌进张家界的画卷里（三天两晚防坑指南),/2019/09/10,3,2000,独自一人,深度游?短途周末?摄影?中秋节,65000
本溪,十月最“火”自驾线路，枫叶之都辽宁本溪寻找最美的秋色,/2019/10/04,3,500,三五好友,自驾?摄影?赏枫?国庆,2490
余杭,迟到的约会，大径山禅意之行,/2019/09/09,3,700,三五好友,短途周末?自驾?中秋节?国庆,89000
广州,@王漭漭［OCT主题乐园3日游］It'sShowTime五彩缤纷周末乐悠游,/2019/09/20,3,1500,三五好友,短途周末?摄影?夏季?国庆,40000
北京,首都北京单人5日游,/2019/09/08,5,1600,独自一人,第一次?深度游?美食,40000
碌曲,国庆自驾川藏滇藏怕高反忧路险不妨到这藏区海拔低路况好车辆少景美爆！,/2019/09/13,1,100,三五好友,第一次?自驾?摄影?中秋节,9359
武汉,早餐很棒，小龙虾无敌，说点带着孩子来武汉的注意事项，我们慢慢玩~,/2019/09/08,6,2000,亲子,美食?中秋节,2579
苏州,古韵苏州，古街与时尚的完美契合,/2019/09/10,3,1500,独自一人,短途周末?中秋节,3923
锦州,辽宁【盘锦-锦州】中秋/北京-红海滩-笔架山3日,/2019/09/13,3,1070,三五好友,短途周末?美食?摄影?中秋节,198000
长白山,夏天里的避暑之旅――长春长白山满洲里哈尔滨,/2019/08/10,8,2500,亲子,自驾?美食?暑假,901
三亚,如果你不快乐，那就去看海吧！四天三晚，轻奢慵懒的三亚时光,/2019/09/10,4,2500,情侣,美食?海滨海岛,59000
九江,上苍之眼领略江南鱼米之乡嘉兴秀洲之美景,/2019/09/09,3,1000,三五好友,环游?端午,13000
荣成,环山东半岛1000公里四日自驾游,/2019/09/10,1,2200,家庭,自驾?中秋节,615000
莆田,Hello，莆田！去百威中国啤酒博物馆，敬一杯酒给远方,/2019/09/11,2,2000,三五好友,深度游?夏季,18000
丰宁,金秋自驾京北第一天路，距离京城最近的秋色，走入仙境归来仍是少年,/2019/09/08,2,400,三五好友,第一次?自驾?摄影?中秋节?国庆,2210
贵阳,桐家的旅行――贵州西江千户苗寨、青岩古镇、中国天眼五日游,/2019/08/18,5,2000,亲子,摄影?暑假,6104
南浔,梦落南浔，难寻秋意,/2019/09/12,2,500,独自一人,短途周末?中秋节,29000
淮安,寻梦运河之都，与淮安的不期而遇！【淮安4天3夜深度游】,/2019/09/01,4,2000,三五好友,深度游?美食?摄影?国庆,57000
重庆,2019重庆游记,/2019/07/23,5,2000,家庭,第一次?夏季,140000
若尔盖,甘南迭部到阿坝若尔盖有一鲜为人知的秘道白龙江进大草原出亲眼看岷山神秘消失！,/2019/08/31,1,100,三五好友,第一次?自驾?摄影?暑假,9506
成都,遇见，成都―那些与美食相关的小美好，这里你都可以找到（5天4夜小众玩法）,/2019/08/08,4,1000,三五好友,短途周末?美食?摄影?夏季,12.8
平遥,领略晋魂--晋北晋中游,/2019/08/17,8,2500,家庭,第一次?美食?古镇?暑假,8735
海宁,海宁盐官古城慢游记，中秋盐官观潮正当时,/2019/09/13,2,1500,三五好友,第一次?美食?古镇?中秋节,14000
成都,"不一样的成都,不一样的美食,探寻天府之国,寻遍江湖美味",/2019/08/30,4,1500,三五好友,美食,106000
成都,人生若遇成都，不负美景不负胃,/2019/08/16,3,1500,三五好友,美食,53000
曼德勒,2019年8月31日跟团去缅甸5晚7日游,/2019/09/11,5,2000,独自一人,第一次,2969
福州,“在福州市区三日游怎么玩？”看一个伪本地大学生的推理解答,/2019/09/10,3,700,三五好友,短途周末?夏季?冬季,5564
淮安,淮安3天2晚深度游，感受“中国运河之都”的多彩魅力,/2019/09/09,3,2500,三五好友,深度游?美食?古镇,156000
南昌,高铁在手，说走就走，看佛系玩家如何南昌这个火炉城市体验冰与火的激情,/2019/09/08,3,1600,闺蜜,短途周末?美食?摄影?暑假,26000
长沙,不以物喜不以己悲，八百里洞庭日月今安在,/2019/03/26,5,1120,家庭,第一次?穷游?踏春,102000
淮安,淮安|去淮安“掼”出不一样的花样（三天两夜游在淮安）,/2019/09/06,3,1500,三五好友,深度游?自驾?赏秋,42000
山海关,中秋十一去哪玩？跟着花橙旅游，开启北京、山海关两地三天欢乐模式,/2019/09/05,1,2000,独自一人,短途周末?自驾?中秋节?国庆,7242
长白山,长白山两日游-许你长相思守，白头到老，山盟海誓,/2019/08/27,3,1400,情侣,短途周末?第一次?穷游?夏季,44000
东营,东营丨黄河入海、孙武故里，初秋奇妙之旅,/2019/09/05,3,1500,三五好友,短途周末?中秋节,34000
甘南,发飙的美仁草原炫丽的十里画廊A面绿染B面金黄国庆大假上上选,/2019/08/27,2,500,三五好友,深度游?自驾?摄影?暑假,35000
凤凰,『去哪儿第一记』那年九月夜未央追忆凤凰古城最美涟漪,/2016/09/13,3,800,家庭,第一次?美食?蜜月,22000
杭州,2019.8.31在杭州对夏日的完美告别,/2019/08/31,1,1000,独自一人,短途周末?夏季,3035
成都,国庆成都怎么玩？成都土著的第N次成都攻略必打卡地点指南,/2019/09/13,1,105,三五好友,短途周末?穷游?美食,26000
张家界,此次一游，都在路上――北纬30°,/2019/08/27,5,870,家庭,第一次?毕业游?古镇?暑假,8015
南京,南京三日游,/2019/08/23,3,1000,学生,第一次?暑假,66000
成都,天府之国是一座来了便不想走的城,/2019/07/30,3,2000,三五好友,第一次?美食?暑假,29000
南京,小球游中国之南京篇,/2019/08/28,6,1500,亲子,第一次?暑假,28000
三门,行至水穷处坐看云起时――2019“三门湾至味”发现体验之旅,/2019/08/21,3,2000,三五好友,徒步?美食?摄影?暑假,35000
曼谷,当地人带你玩泰国，趣味曼谷+悠闲清迈（含美食、娱乐、购物、住宿全攻略）,/2019/05/24,7,2000,情侣,深度游?购物?美食?夏季?暑假,40000
银川,收下这份宁夏玩乐地图（固原+中卫+银川）,/2019/08/01,7,2000,三五好友,美食?暑假,25000
连云港,二访大美之境―连云港花果山,/2019/08/24,3,2000,三五好友,深度游?短途周末?摄影?暑假,36000
广州,广州7天深度亲子游之吃喝玩乐篇,/2019/08/11,5,1500,亲子,深度游?美食?暑假,9317
玉溪,云南小众旅行地，最美湖景让人醉,/2019/08/18,4,2500,情侣,深度游?短途周末?摄影?赏秋,59000
济南,初春青岛之行,/2019/02/28,5,2000,独自一人,海滨海岛?冬季,444
广州,广州7天深度亲子游之玩在长隆,/2019/08/09,2,1200,家庭,第一次?暑假,83000
北京,2019暑假北京游记【超字攻略，详尽无比】,/2019/08/06,6,2000,家庭,第一次?徒步?暑假,14000
神农架,说走咱就走，神农架5天，自由行。神龙架双动5日游1500元,/2019/08/15,5,1500,家庭,第一次?深度游?暑假?夏季,218000
甘南,甘南十日游,/2020/08/21,10,1200,三五好友,摄影?美食?自驾?赏秋,374
厦门,又见AMOY（鹭岛厦门）,/2019/09/18,1,2500,家庭,深度游?古镇?海滨海岛,764
鹤山,鹤山两日休闲亲子游，与自然为伴的艺术之旅,/2019/08/17,2,1000,亲子,短途周末?美食?夏季?暑假,19000
全南,解锁私藏小众地｜广东的后花园，江西的长寿乡,/2019/08/10,2,700,三五好友,第一次?短途周末?自驾?夏季?暑假,32000
深圳,三天两晚国家级旅游度假区邂逅华侨城文化旅游节，带着花橙漫游所城,/2019/08/28,3,2000,独自一人,深度游,56000
阿坝,探秘遗落人间的仙境，与阿坝的不期而遇！,/2019/08/08,3,2000,三五好友,深度游?中秋节?国庆,87000
成都,带着老爸老妈游四川~峨眉成都六日游记,/2019/08/11,7,2500,家庭,深度游?自驾?摄影?夏季?暑假,6607
重庆,38°暴晒下的“闹心”之行,/2019/08/12,5,2300,家庭,第一次?美食?暑假,632
福鼎,福建最有趣的一座山，有生之年，一定要去一趟,/2019/07/27,2,1000,三五好友,深度游?短途周末?摄影?夏季,12000
天津,俯天津之眼?，童年动物园?，民国特色馆?游海洋公园?天津亲子3日游?,/2018/08/10,3,650,亲子,美食?摄影?短途周末?人文?漫游?夏季?暑假,2887
昆明,放飞心灵打卡之旅：昆明―弥勒―普者黑―乌蒙大草原7日游,/2019/08/11,7,2200,三五好友,第一次?自驾?暑假,6276
广州,想打死同伴的广州三日游,/2019/08/13,3,2680,三五好友,第一次?美食,829000
成都,孤独患者寻味记,/2019/07/15,5,1000,三五好友,短途周末?美食?温泉?夏季?暑假,119000
杭州,被利奇马挽留的杭城之美,/2019/08/16,3,1500,独自一人,短途周末?美食,3842
贵阳,去贵阳花溪，避暑热，学儒家，拜孔子,/2019/08/10,2,1000,亲子,短途周末?穷游?古镇?暑假,28000
重庆,重庆4日游（内附干货！）,/2019/08/15,4,2000,学生,第一次?美食?夏季,5419
西双版纳,三口之家科普自驾游-雅安熊猫基地-红军强渡大渡河-西双版纳植物园-昆明西山龙门,/2019/08/03,8,2600,家庭,自驾?美食?暑假,2827
阳朔,八月，桂林阳朔3日休闲游，一场歌舞唱响八桂大地,/2019/08/14,3,2000,三五好友,深度游?夏季,88000
阳朔,"广西桂林,龙脊梯田,阳朔端午自驾3日游",/2019/06/07,3,1000,家庭,自驾?端午,1530
银川,奔走与狂欢的青春，沃野与神秘的宁夏~,/2019/08/12,6,2000,情侣,毕业游?摄影?暑假,43000
宝鸡,宝鸡大水川景区三日游,/2019/08/02,3,1000,亲子,自驾,34000
承德,"承德,乌兰布统,塞罕坝6日家庭自驾游！",/2019/07/29,6,1100,家庭,自驾?夏季,6355
南京,2019暑假南京亲子慢游8日,/2019/08/09,8,2000,家庭,第一次?暑假,3507
长沙,憨居居慢节奏之旅,/2019/08/12,6,1500,学生,毕业游?夏季,2745
长春,长春游记,/2019/08/02,1,150,独自一人,徒步?穷游,106000
宁波,宁波两日，好的天气自然是好心情,/2019/08/01,2,1500,独自一人,第一次?短途周末,42000
兰州,“兰州”不会把你当旅人，会把当一个多年未曾相识的老朋友。,/2019/08/09,3,800,独自一人,短途周末?骑行?美食?五一?国庆,49000
宁波,蓝天白云突然暴风雨，跟着我换个地方过周末,/2019/08/04,2,500,三五好友,短途周末?美食,3586
西安,到长安城探访历史的足迹,/2019/08/09,6,2000,亲子,美食?徒步?暑假,4365
黄山,黄山+宏村四日三晚亲子游,/2019/08/03,4,2000,亲子,第一次?古镇?短途周末?暑假?夏季,5746
日照,带你看我眼中的日照，看花、赏竹、游泳、航拍，这样玩才最嗨！,/2019/08/06,3,500,三五好友,深度游?短途周末?自驾?暑假?中秋节,11000
北京,北京8日游,/2019/07/10,8,2200,三五好友,第一次?深度游?穷游?暑假,3037
厦门,三口之家的厦门亲子游记,/2019/07/31,3,2300,家庭,第一次?美食?摄影?暑假,95000
卓尼,离天堂最近仅一座城一块石一个寺一条沟就迷死人想知道它在哪儿吗？,/2019/07/24,2,600,三五好友,第一次?深度游?自驾?夏季,84000
景德镇,这个暑假，跟着“杰伦女孩”去景德镇过涨知识的周末,/2019/07/27,2,1000,三五好友,短途周末?美食?古镇?夏季,17000
青岛,青岛金沙滩?崂山望胶东?赏蓬莱仙境?清爽长岛游?亲子8日游???,/2019/07/17,8,2300,亲子,海滨海岛?美食?摄影?夏季?暑假,8675
五台山,心之所往，我的五台山朝圣之旅,/2019/07/19,4,1300,三五好友,徒步?夏季,7334
洛阳,暮春时节赏牡丹游嵩山看开封,/2019/04/24,5,2300,闺蜜,穷游,5874
永嘉,诗画浙江，山水秉承，与你漫步在悠悠楠溪江,/2019/07/27,3,1500,三五好友,深度游?短途周末?摄影?夏季,107000
小金,纯净小金，拥有让人震撼之美，也是凉爽的避暑胜地,/2019/08/04,3,2000,情侣,第一次?短途周末?徒步?夏季?暑假,63000
温州,逃离高温酷暑，来楠溪江过个清凉夏日，寻瀑布乘竹筏看美景,/2019/08/03,3,1000,三五好友,第一次?自驾?夏季?暑假,31000
珠海,广州出发！上班族周末的正确打开方式――珠海悠闲2日游,/2019/08/03,2,500,闺蜜,短途周末?摄影?海滨海岛?夏季?暑假,4346
句容,夏日仙居茅山之上,/2019/07/26,3,2000,三五好友,短途周末?徒步?摄影,5159
海西,4天3夜，西北自驾の青海夏日风光大赏,/2019/08/02,4,2000,家庭,短途周末?自驾?摄影?夏季?暑假,4639
怡保,偷一点时间，去感受西马的温柔夏夜,/2019/08/02,5,2000,闺蜜,短途周末?摄影?夏季,1595
文成,消夏避暑自驾文成，带你感受浙南山水的清凉之意,/2019/07/26,3,1800,三五好友,深度游?自驾?摄影,67000
成都,浮生一日成都十二时辰旅行攻略实记,/2019/07/27,1,150,三五好友,短途周末,86000
铁岭,铁岭游记,/2016/07/31,2,200,独自一人,徒步?穷游,198000
抚顺,抚顺游记,/2017/05/30,2,200,独自一人,徒步?穷游,97000
小金,转山转水遇上四姑娘山，在川西体验最美户外天堂丨四姑娘山攻略,/2019/06/05,4,2000,三五好友,徒步?摄影?探险?夏季,17000
青海湖,今后，永远不会在同一个时空中邂逅同样的诗意――七月青海湖行记,/2019/07/23,3,500,情侣,深度游?自驾?摄影?暑假,13000
武汉,花点时间游武汉・三天两夜武汉自驾,/2019/07/29,3,2000,三五好友,深度游?短途周末?自驾?夏季,33000
广州,广州长胖记|不能错过的日料美食,/2019/07/13,3,1500,情侣,美食?夏季,25000
顺德,一个人也要寻味顺德，暴雨、孤独和坏心情都阻止不了吃货的心,/2019/07/22,2,1400,独自一人,短途周末?美食,53000
青岛,青岛，是夏天的味道,/2019/07/18,3,2300,独自一人,第一次?夏季,98000
大同,我们的自驾大同之旅,/2019/06/22,2,1200,情侣,短途周末?自驾?美食?踏春?夏季,2327
温州,三天两夜玩转”长寿之乡”温州文成,/2019/07/26,3,799,三五好友,第一次?自驾?摄影?夏季,44000
大连,2019暑假大连亲子6日游,/2019/07/21,9,2300,家庭,第一次?暑假,86.6
文成,三日游文成―在江南小镇里寻找慢时光【暑假小众景点打卡推荐】,/2019/07/26,5,2000,三五好友,深度游?摄影?暑假,89000
普吉岛,普吉岛跟团游是一种什么体验？多图航拍视角跟大家讲解。,/2019/07/26,5,2999,三五好友,第一次?潜水?夏季,109000
重庆,成都啊成都，重庆啊重庆~,/2019/07/08,7,2200,家庭,第一次?美食?夏季,6093
厦门,厦门｜时光往复，我愿爱你如初,/2019/07/12,3,1000,闺蜜,短途周末?暑假,54000
武陵源,故地重游，三天两夜探寻张家界的吃喝玩乐,/2019/07/24,4,2500,独自一人,穷游?摄影?暑假,43000
张家界,时隔四年再来张家界，重温科幻般的绝世风光,/2019/07/24,3,2500,三五好友,深度游?摄影?暑假,51000
长沙,君幸食：味觉长沙（长沙四天三夜家庭游）,/2019/07/19,4,2000,家庭,短途周末?暑假,3671
乌镇,这个夏天，带娃去乌村体验陶渊明笔下的桃花源，来乌村参加夏令营吧！,/2019/07/07,3,1000,亲子,短途周末?自驾?暑假,28000
成都,打卡小众景点，遍寻成都网红美食！唯有爱与美食不可辜负～,/2019/07/05,3,2000,三五好友,深度游?短途周末?美食?暑假,57000
西安,西安，历史与美食交错的一场旅程,/2019/05/18,5,2500,闺蜜,第一次,1515
桂林,从阳朔到桂林，遇见米粉遇见你|五天四夜在桂林,/2019/07/16,1,2000,闺蜜,第一次,7157
西安,端午游西安登华山,/2018/06/15,5,2100,闺蜜,穷游?端午,54000
黄山,梦幻徽州我来啦！（内含多图）,/2019/07/10,7,2500,三五好友,第一次?暑假?夏季,9871
厦门,【游记】住在这里后，我再也不想去鼓浪屿了！,/2019/06/21,2,1000,三五好友,美食?摄影?海滨海岛?夏季,92000
巩留,尼勒克百里画廊闻名遐迩殊不知天山深处还有一个而且是世界遗产！,/2019/06/24,1,300,三五好友,第一次?深度游?自驾?夏季,26000
伊犁,听别人说看网上图等于零只有切身自驾一回伊昭公路你才知道这条路有多销魂！,/2019/06/20,1,150,三五好友,第一次?自驾?摄影?夏季,9166
上海,三天两夜的魔都游，是什么和迪士尼最配？,/2019/05/01,3,1800,情侣,短途周末?美食?古镇?五一,38000
杭州,左手遗址文明，右手现代艺术，我在良渚寻访江南源头,/2019/07/16,3,800,三五好友,深度游?短途周末?摄影,50000
黄山,期待遇见美绝的黄山,/2019/07/05,3,2000,闺蜜,第一次?夏季,1792
杭州,【苏杭】忙里偷闲下苏杭，夏日里的穿越小确幸,/2019/07/15,3,2500,家庭,深度游?短途周末?摄影?夏季?暑假,38000
三亚,三亚海滩度假，玩转盛夏，穿越千古情缘,/2019/07/03,3,1500,独自一人,短途周末?骑行?摄影?暑假,22000
恩施,【恩施漫步】风吟浅夏，绿染流光。（恩施小长假之行）,/2019/05/01,4,1500,家庭,第一次?徒步?摄影?五一,61000
镇江,何处望神州――镇江逛吃两日游,/2019/07/06,2,500,闺蜜,第一次?短途周末?夏季?暑假,3698
